{
  "$schema": "https://json-schema.org/draft/2020-12/schema",
  "$id": "https://hanifcarroll.com/schemas/project-video-manifest.json",
  "title": "Portfolio project video manifest",
  "type": "object",
  "additionalProperties": false,
  "required": [
    "version",
    "slug",
    "title",
    "family",
    "timing",
    "viewer",
    "takeaway",
    "theme",
    "scenes",
    "posterAt",
    "privacy",
    "sources",
    "generation"
  ],
  "properties": {
    "$schema": { "type": "string" },
    "version": { "const": 1 },
    "slug": { "type": "string", "pattern": "^[a-z0-9]+(?:-[a-z0-9]+)*$" },
    "title": { "type": "string", "minLength": 1 },
    "family": { "enum": ["system-proof", "product-journey", "visual-showcase"] },
    "timing": { "enum": ["standard", "short", "loop"] },
    "viewer": { "type": "string", "minLength": 1 },
    "takeaway": { "type": "string", "minLength": 1 },
    "theme": { "$ref": "#/$defs/theme" },
    "scenes": {
      "type": "array",
      "minItems": 4,
      "maxItems": 6,
      "items": { "$ref": "#/$defs/scene" }
    },
    "posterAt": { "type": "number", "minimum": 0 },
    "privacy": {
      "type": "object",
      "additionalProperties": false,
      "required": ["hide", "safe"],
      "properties": {
        "hide": { "type": "array", "items": { "type": "string", "minLength": 1 } },
        "safe": { "type": "array", "items": { "type": "string", "minLength": 1 } }
      }
    },
    "sources": {
      "type": "array",
      "minItems": 1,
      "items": { "type": "string", "minLength": 1 }
    },
    "generation": {
      "type": "object",
      "additionalProperties": false,
      "required": ["model", "templateVersion", "hyperframesVersion"],
      "properties": {
        "model": { "const": "gpt-5.6-sol" },
        "templateVersion": { "type": "string", "pattern": "^\\d+\\.\\d+\\.\\d+$" },
        "hyperframesVersion": { "type": "string", "pattern": "^\\d+\\.\\d+\\.\\d+$" },
        "sourceCommit": { "type": "string" },
        "generatedAt": { "type": "string", "format": "date-time" }
      }
    }
  },
  "$defs": {
    "hex": { "type": "string", "pattern": "^#[0-9A-Fa-f]{6}$" },
    "theme": {
      "type": "object",
      "additionalProperties": false,
      "required": [
        "canvas",
        "surface",
        "ink",
        "muted",
        "border",
        "accent",
        "accentSoft",
        "accent2",
        "deep",
        "fontDisplay",
        "fontBody",
        "fontMono",
        "motif"
      ],
      "properties": {
        "canvas": { "$ref": "#/$defs/hex" },
        "surface": { "$ref": "#/$defs/hex" },
        "ink": { "$ref": "#/$defs/hex" },
        "muted": { "$ref": "#/$defs/hex" },
        "border": { "$ref": "#/$defs/hex" },
        "accent": { "$ref": "#/$defs/hex" },
        "accentSoft": { "$ref": "#/$defs/hex" },
        "accent2": { "$ref": "#/$defs/hex" },
        "deep": { "$ref": "#/$defs/hex" },
        "fontDisplay": { "type": "string", "minLength": 1 },
        "fontBody": { "type": "string", "minLength": 1 },
        "fontMono": { "type": "string", "minLength": 1 },
        "motif": { "enum": ["rails", "path", "gallery"] }
      }
    },
    "label": {
      "type": "object",
      "additionalProperties": false,
      "required": ["title", "body"],
      "properties": {
        "title": { "type": "string", "minLength": 1 },
        "body": { "type": "string", "minLength": 1 }
      }
    },
    "stat": {
      "type": "object",
      "additionalProperties": false,
      "required": ["value", "label"],
      "properties": {
        "value": { "type": "string", "minLength": 1 },
        "label": { "type": "string", "minLength": 1 }
      }
    },
    "scene": {
      "type": "object",
      "additionalProperties": false,
      "dependentRequired": { "asset": ["assetAlt"] },
      "required": [
        "id",
        "kind",
        "eyebrow",
        "headline",
        "body",
        "duration",
        "layout",
        "transition",
        "motion"
      ],
      "properties": {
        "id": { "type": "string", "pattern": "^[a-z0-9]+(?:-[a-z0-9]+)*$" },
        "kind": {
          "enum": [
            "problem",
            "context",
            "action",
            "workflow",
            "evidence",
            "report",
            "showcase",
            "result",
            "end"
          ]
        },
        "eyebrow": { "type": "string", "minLength": 1 },
        "headline": { "type": "string", "minLength": 1 },
        "body": { "type": "string", "minLength": 1 },
        "duration": { "type": "number", "minimum": 2.5 },
        "layout": { "enum": ["copy-left", "copy-right", "full", "stack", "rail", "report"] },
        "asset": { "type": "string", "minLength": 1 },
        "assetAlt": { "type": "string" },
        "assetFit": { "enum": ["cover", "contain"] },
        "assetPosition": { "type": "string" },
        "labels": {
          "type": "array",
          "maxItems": 4,
          "items": { "$ref": "#/$defs/label" }
        },
        "stat": { "$ref": "#/$defs/stat" },
        "transition": { "enum": ["push-left", "push-up", "dissolve"] },
        "motion": { "enum": ["assemble", "settle", "scroll", "drift"] }
      }
    }
  }
}
