{
  "$schema": "../../docs/project-videos/video-manifest.schema.json",
  "version": 1,
  "slug": "health-ai-search-audit",
  "title": "Helping a Health Services Startup Show Up in AI Search",
  "family": "system-proof",
  "timing": "standard",
  "viewer": "Founder, website helper, or portfolio reviewer",
  "takeaway": "This is a repeatable, evidence-backed review with clear fixes, not a claim that rankings, mentions, or sales already improved.",
  "theme": {
    "canvas": "#eef3f3",
    "surface": "#ffffff",
    "ink": "#182231",
    "muted": "#52606d",
    "border": "#d4dde6",
    "accent": "#2f9ed9",
    "accentSoft": "#eaf4fb",
    "accent2": "#31c98b",
    "deep": "#182231",
    "fontDisplay": "EB Garamond, serif",
    "fontBody": "Inter, sans-serif",
    "fontMono": "JetBrains Mono, monospace",
    "motif": "rails"
  },
  "scenes": [
    {
      "id": "unclear-visibility",
      "kind": "problem",
      "eyebrow": "The question",
      "headline": "AI search visibility was hard to see.",
      "body": "The founder needed evidence, not generic tips.",
      "duration": 7.4,
      "layout": "stack",
      "labels": [
        {
          "title": "Appeared",
          "body": "Where?"
        },
        {
          "title": "Missing",
          "body": "Which searches?"
        },
        {
          "title": "Next steps",
          "body": "What can change?"
        }
      ],
      "transition": "push-left",
      "motion": "assemble"
    },
    {
      "id": "public-evidence-only",
      "kind": "context",
      "eyebrow": "The boundary",
      "headline": "The review used public evidence only.",
      "body": "No analytics, website admin, or server access.",
      "duration": 7.6,
      "layout": "rail",
      "labels": [
        {
          "title": "Public website",
          "body": "Readable pages"
        },
        {
          "title": "Public blog",
          "body": "Separate source"
        },
        {
          "title": "Search answers",
          "body": "Live evidence"
        }
      ],
      "transition": "push-left",
      "motion": "assemble"
    },
    {
      "id": "search-coverage",
      "kind": "workflow",
      "eyebrow": "Search tests",
      "headline": "I tested 74 search situations.",
      "body": "Spanish and English questions covered four major search tools.",
      "duration": 8,
      "layout": "report",
      "asset": "../../src/assets/img/projects/health-ai-search-audit-report.png",
      "assetAlt": "Public AI-search audit preview with tested, checked, rechecked, and fix-list counts.",
      "assetFit": "contain",
      "assetPosition": "center 34%",
      "labels": [
        {
          "title": "ChatGPT Search",
          "body": "Search answers"
        },
        {
          "title": "Gemini",
          "body": "Search answers"
        },
        {
          "title": "Google",
          "body": "Search answers"
        },
        {
          "title": "Perplexity",
          "body": "Search answers"
        }
      ],
      "stat": {
        "value": "74",
        "label": "search situations"
      },
      "transition": "push-up",
      "motion": "settle"
    },
    {
      "id": "browser-checked-evidence",
      "kind": "evidence",
      "eyebrow": "Direct evidence",
      "headline": "The checks showed where the business appeared or went missing.",
      "body": "Thirty-three results were checked directly in the browser.",
      "duration": 8,
      "layout": "copy-left",
      "asset": "../../src/assets/img/projects/health-ai-search-audit-report.png",
      "assetAlt": "Public audit preview showing browser-checked evidence and findings.",
      "assetFit": "contain",
      "assetPosition": "center 48%",
      "stat": {
        "value": "33",
        "label": "browser-checked results"
      },
      "transition": "dissolve",
      "motion": "settle"
    },
    {
      "id": "private-report",
      "kind": "report",
      "eyebrow": "The report",
      "headline": "The findings became a private report with 9 fixes.",
      "body": "Evidence and monthly checks keep the review reusable.",
      "duration": 8,
      "layout": "copy-right",
      "asset": "../../src/assets/img/projects/health-ai-search-audit-report.png",
      "assetAlt": "Public audit preview showing the fix list and client delivery summary.",
      "assetFit": "contain",
      "assetPosition": "center 62%",
      "stat": {
        "value": "9",
        "label": "website fixes"
      },
      "transition": "push-left",
      "motion": "drift"
    },
    {
      "id": "health-ai-search-audit-end",
      "kind": "end",
      "eyebrow": "AI Search Visibility Review",
      "headline": "Public evidence.",
      "body": "Clear next steps.",
      "duration": 3,
      "layout": "full",
      "transition": "dissolve",
      "motion": "settle"
    }
  ],
  "posterAt": 26,
  "privacy": {
    "hide": [
      "protected report URL, password, private report pages, and private client details",
      "private analytics, website-admin, or server data",
      "unproven medical, compliance, ranking, mention, or sales outcomes"
    ],
    "safe": [
      "public report preview used by the case study",
      "published evidence counts and search-tool names",
      "plain synthetic review and source labels"
    ]
  },
  "sources": [
    "brief.md",
    "project-video-source.md",
    "sources.md",
    "../../src/content/case-studies/health-ai-search-audit.mdx",
    "../../src/lib/projects/health-ai-search-audit.json",
    "../../src/assets/img/projects/health-ai-search-audit-report.png"
  ],
  "generation": {
    "model": "gpt-5.6-sol",
    "templateVersion": "1.0.0",
    "hyperframesVersion": "0.7.46"
  }
}
