{
  "$schema": "../../docs/project-videos/video-manifest.schema.json",
  "version": 1,
  "slug": "casa-elaria",
  "title": "Casa Elaria",
  "family": "product-journey",
  "timing": "loop",
  "viewer": "Hiring manager or general portfolio viewer",
  "takeaway": "This is a focused validation build that turned a product idea into a demand signal.",
  "theme": {
    "canvas": "#f5f1e8",
    "surface": "#fffaf1",
    "ink": "#211f18",
    "muted": "#665f50",
    "border": "#d9cfbd",
    "accent": "#304b10",
    "accentSoft": "#e5ead8",
    "accent2": "#b88a35",
    "deep": "#1f2717",
    "fontDisplay": "EB Garamond, serif",
    "fontBody": "Inter, sans-serif",
    "fontMono": "JetBrains Mono, monospace",
    "motif": "path"
  },
  "scenes": [
    {
      "id": "product-idea",
      "kind": "problem",
      "eyebrow": "Product idea",
      "headline": "A beauty idea needed a real test.",
      "body": "Inventory came later.",
      "duration": 5,
      "layout": "copy-left",
      "asset": "assets/selected/casa-elaria-hero.png",
      "assetAlt": "Casa Elaria storefront hero",
      "assetFit": "cover",
      "assetPosition": "center center",
      "labels": [
        {
          "title": "Product idea",
          "body": "Promising direction"
        },
        {
          "title": "Inventory risk",
          "body": "Real upfront spend"
        }
      ],
      "transition": "push-left",
      "motion": "settle"
    },
    {
      "id": "storefront-test",
      "kind": "showcase",
      "eyebrow": "Storefront test",
      "headline": "The storefront looked real.",
      "body": "Visitors could browse, choose, and add to cart.",
      "duration": 5,
      "layout": "copy-right",
      "asset": "assets/selected/casa-elaria-product-page.png",
      "assetAlt": "Casa Elaria public product page",
      "assetFit": "contain",
      "assetPosition": "center center",
      "transition": "push-up",
      "motion": "settle"
    },
    {
      "id": "checkout-test",
      "kind": "action",
      "eyebrow": "Checkout",
      "headline": "Checkout became the test.",
      "body": "No payment, just launch-list interest.",
      "duration": 4,
      "layout": "rail",
      "asset": "assets/selected/casa-elaria-product-page.png",
      "assetAlt": "Casa Elaria product page used for the checkout test",
      "assetFit": "contain",
      "assetPosition": "center center",
      "labels": [
        {
          "title": "Browse",
          "body": "Review the products"
        },
        {
          "title": "Choose",
          "body": "Show product intent"
        },
        {
          "title": "Checkout",
          "body": "Join the launch list"
        }
      ],
      "transition": "push-left",
      "motion": "assemble"
    },
    {
      "id": "demand-signal",
      "kind": "result",
      "eyebrow": "Demand signal",
      "headline": "The signal was simple.",
      "body": "Which products earned buyer intent?",
      "duration": 4,
      "layout": "stack",
      "labels": [
        {
          "title": "Product clicks",
          "body": "What drew attention"
        },
        {
          "title": "Launch list",
          "body": "Who wanted updates"
        },
        {
          "title": "Stock decision",
          "body": "What to test next"
        }
      ],
      "transition": "push-up",
      "motion": "assemble"
    },
    {
      "id": "end",
      "kind": "end",
      "eyebrow": "Casa Elaria",
      "headline": "Casa Elaria",
      "body": "Demand before inventory.",
      "duration": 3,
      "layout": "full",
      "asset": "assets/selected/casa-elaria-hero.png",
      "assetAlt": "Settled Casa Elaria storefront",
      "assetFit": "cover",
      "assetPosition": "center center",
      "transition": "dissolve",
      "motion": "settle"
    }
  ],
  "posterAt": 7.5,
  "privacy": {
    "hide": [
      "Private analytics",
      "Real email addresses",
      "Accounts and billing details",
      "Tokens, cookies, and local paths",
      "Client-sensitive operating details"
    ],
    "safe": [
      "Public Casa Elaria screenshots",
      "Public project name",
      "Plain ecommerce and validation labels",
      "Synthetic signal cards"
    ]
  },
  "sources": [
    "brief.md",
    "project-video-source.md",
    "design.md",
    "sources.md",
    "../../src/content/case-studies/casa-elaria.mdx",
    "../../src/lib/projects/casa-elaria.json",
    "assets/selected/casa-elaria-hero.png",
    "assets/selected/casa-elaria-product-page.png"
  ],
  "generation": {
    "model": "gpt-5.6-sol",
    "templateVersion": "1.0.0",
    "hyperframesVersion": "0.7.46"
  }
}
