{
  "$schema": "../../docs/project-videos/video-manifest.schema.json",
  "version": 1,
  "slug": "desarmadero-latorre",
  "title": "Desarmadero Latorre",
  "family": "product-journey",
  "timing": "loop",
  "viewer": "Hiring manager or general portfolio viewer",
  "takeaway": "This is a practical workflow improvement: customers search first, inspect part context, and contact the shop with a better question.",
  "theme": {
    "canvas": "#f3f1ec",
    "surface": "#fffdf8",
    "ink": "#20211f",
    "muted": "#62635f",
    "border": "#d8d3ca",
    "accent": "#55bfe8",
    "accentSoft": "#d9f3fb",
    "accent2": "#b47a48",
    "deep": "#24343a",
    "fontDisplay": "Oswald, sans-serif",
    "fontBody": "Montserrat, sans-serif",
    "fontMono": "Space Mono, monospace",
    "motif": "path"
  },
  "scenes": [
    {
      "id": "phone-first",
      "kind": "problem",
      "eyebrow": "Phone-first checks",
      "headline": "Stock checks started by phone.",
      "body": "Staff repeated availability checks.",
      "duration": 4.4,
      "layout": "copy-left",
      "asset": "assets/selected/parts-stockroom.png",
      "assetAlt": "Public Desarmadero Latorre parts stockroom",
      "assetFit": "cover",
      "assetPosition": "center center",
      "labels": [
        {
          "title": "Phone",
          "body": "Ask about stock"
        },
        {
          "title": "Staff",
          "body": "Check again"
        },
        {
          "title": "Customer",
          "body": "Wait for an answer"
        }
      ],
      "transition": "push-left",
      "motion": "drift"
    },
    {
      "id": "searchable-catalog",
      "kind": "action",
      "eyebrow": "Searchable catalog",
      "headline": "The catalog made stock searchable.",
      "body": "Make and model come first.",
      "duration": 4.4,
      "layout": "copy-right",
      "asset": "assets/selected/desarmadero-catalog.png",
      "assetAlt": "Public Desarmadero Latorre parts catalog",
      "assetFit": "contain",
      "assetPosition": "center center",
      "labels": [
        {
          "title": "Make",
          "body": "Choose the vehicle brand"
        },
        {
          "title": "Model",
          "body": "Narrow the search"
        },
        {
          "title": "Year",
          "body": "Check the fit"
        }
      ],
      "transition": "push-up",
      "motion": "settle"
    },
    {
      "id": "part-context",
      "kind": "evidence",
      "eyebrow": "Part information",
      "headline": "Listings carry context.",
      "body": "Photos, year, and vehicle details.",
      "duration": 4.4,
      "layout": "report",
      "asset": "assets/selected/desarmadero-catalog.png",
      "assetAlt": "Catalog listing with public part context",
      "assetFit": "contain",
      "assetPosition": "center center",
      "labels": [
        {
          "title": "Photos",
          "body": "See the part"
        },
        {
          "title": "Year",
          "body": "Check compatibility"
        },
        {
          "title": "Details",
          "body": "Ask a better question"
        }
      ],
      "transition": "push-left",
      "motion": "assemble"
    },
    {
      "id": "clearer-workflow",
      "kind": "result",
      "eyebrow": "Clearer workflow",
      "headline": "The workflow got clearer.",
      "body": "Search, inspect, then contact.",
      "duration": 4.8,
      "layout": "rail",
      "asset": "assets/selected/desarmadero-catalog.png",
      "assetAlt": "Desarmadero Latorre catalog search surface",
      "assetFit": "contain",
      "assetPosition": "center center",
      "labels": [
        {
          "title": "Search",
          "body": "Find likely stock"
        },
        {
          "title": "Inspect",
          "body": "Review part context"
        },
        {
          "title": "Contact",
          "body": "Ask a specific question"
        }
      ],
      "transition": "push-up",
      "motion": "assemble"
    },
    {
      "id": "end",
      "kind": "end",
      "eyebrow": "Desarmadero Latorre",
      "headline": "Desarmadero Latorre",
      "body": "A searchable digital stockroom.",
      "duration": 3,
      "layout": "full",
      "asset": "assets/selected/desarmadero-catalog.png",
      "assetAlt": "Settled Desarmadero Latorre catalog",
      "assetFit": "contain",
      "assetPosition": "center center",
      "transition": "dissolve",
      "motion": "settle"
    }
  ],
  "posterAt": 19.5,
  "privacy": {
    "hide": [
      "Private inventory admin views",
      "Customer details",
      "Account data",
      "Tokens, cookies, and local paths"
    ],
    "safe": [
      "Public catalog screenshot",
      "Public stockroom photo",
      "Public project name",
      "Synthetic workflow labels"
    ]
  },
  "sources": [
    "brief.md",
    "project-video-source.md",
    "design.md",
    "sources.md",
    "../../src/content/case-studies/desarmadero-latorre.mdx",
    "../../src/lib/projects/desarmadero-latorre.json",
    "assets/selected/desarmadero-catalog.png",
    "assets/selected/parts-stockroom.png"
  ],
  "generation": {
    "model": "gpt-5.6-sol",
    "templateVersion": "1.0.0",
    "hyperframesVersion": "0.7.46"
  }
}
