{
  "$schema": "../../docs/project-videos/video-manifest.schema.json",
  "version": 1,
  "slug": "language-exchange",
  "title": "Language Exchange Platform",
  "family": "product-journey",
  "timing": "short",
  "viewer": "Hiring manager or general portfolio viewer",
  "takeaway": "This is a working MVP that turns a messy local practice problem into a testable product loop.",
  "theme": {
    "canvas": "#f4f7fb",
    "surface": "#ffffff",
    "ink": "#101827",
    "muted": "#52627a",
    "border": "#dce4ef",
    "accent": "#215dff",
    "accentSoft": "#eaf0ff",
    "accent2": "#1f7a5d",
    "deep": "#111827",
    "fontDisplay": "EB Garamond, serif",
    "fontBody": "Inter, sans-serif",
    "fontMono": "JetBrains Mono, monospace",
    "motif": "path"
  },
  "scenes": [
    {
      "id": "hard-to-make-real",
      "kind": "problem",
      "eyebrow": "The problem",
      "headline": "Practice was hard to make real.",
      "body": "Big events got in the way.",
      "duration": 5.5,
      "layout": "stack",
      "labels": [
        {
          "title": "Endless profiles",
          "body": "Too much browsing"
        },
        {
          "title": "Big events",
          "body": "Too little focus"
        },
        {
          "title": "Local practice",
          "body": "Still hard to arrange"
        }
      ],
      "transition": "push-left",
      "motion": "assemble"
    },
    {
      "id": "small-exchanges",
      "kind": "action",
      "eyebrow": "Small groups",
      "headline": "HablaBA centers the exchange.",
      "body": "Find small groups by neighborhood and language.",
      "duration": 5.5,
      "layout": "copy-left",
      "asset": "assets/redacted/hablaba-hero.png",
      "assetAlt": "HablaBA neighborhood exchange discovery screen",
      "assetFit": "contain",
      "assetPosition": "center center",
      "transition": "dissolve",
      "motion": "settle"
    },
    {
      "id": "nearby-exchange",
      "kind": "showcase",
      "eyebrow": "Explore",
      "headline": "Explore a nearby exchange.",
      "body": "See time, place, language, and open seats.",
      "duration": 5.5,
      "layout": "copy-right",
      "asset": "assets/redacted/hablaba-hero.png",
      "assetAlt": "HablaBA exchange details and open seats",
      "assetFit": "contain",
      "assetPosition": "center center",
      "labels": [
        {
          "title": "Time",
          "body": "When the group meets"
        },
        {
          "title": "Place",
          "body": "Where to join"
        },
        {
          "title": "Language",
          "body": "What people practice"
        },
        {
          "title": "Open seats",
          "body": "Who can join"
        }
      ],
      "transition": "push-left",
      "motion": "settle"
    },
    {
      "id": "group-chat",
      "kind": "workflow",
      "eyebrow": "Coordinate",
      "headline": "Join the group chat.",
      "body": "People coordinate topics, timing, and practice together.",
      "duration": 5.5,
      "layout": "copy-left",
      "asset": "assets/redacted/hablaba-feature.png",
      "assetAlt": "HablaBA small-group chat interface",
      "assetFit": "contain",
      "assetPosition": "center center",
      "labels": [
        {
          "title": "Topics",
          "body": "What to practice"
        },
        {
          "title": "Timing",
          "body": "When to meet"
        },
        {
          "title": "Chat",
          "body": "Keep the group aligned"
        }
      ],
      "transition": "push-up",
      "motion": "assemble"
    },
    {
      "id": "connected-loop",
      "kind": "result",
      "eyebrow": "The result",
      "headline": "Discovery, chat, and planning stay connected.",
      "body": "Web and mobile work together.",
      "duration": 5,
      "layout": "rail",
      "asset": "assets/redacted/hablaba-feature.png",
      "assetAlt": "HablaBA connected discovery and chat product loop",
      "assetFit": "contain",
      "assetPosition": "center center",
      "transition": "dissolve",
      "motion": "settle"
    },
    {
      "id": "end",
      "kind": "end",
      "eyebrow": "Language Exchange",
      "headline": "Language Exchange",
      "body": "Local practice, ready to test.",
      "duration": 3,
      "layout": "full",
      "asset": "assets/redacted/hablaba-hero.png",
      "assetAlt": "Settled HablaBA exchange discovery screen",
      "assetFit": "contain",
      "assetPosition": "center center",
      "transition": "dissolve",
      "motion": "settle"
    }
  ],
  "posterAt": 13.5,
  "privacy": {
    "hide": [
      "Stack names, API endpoints, test output, command output, and local paths",
      "Profile photos",
      "Account controls",
      "Usernames"
    ],
    "safe": [
      "Public portfolio screenshots with synthetic examples",
      "Public project name",
      "Small-group exchange labels",
      "Neighborhood, language, and open-seat details"
    ]
  },
  "sources": [
    "brief.md",
    "project-video-source.md",
    "design.md",
    "sources.md",
    "../../src/content/case-studies/language-exchange.mdx",
    "../../src/lib/projects/language-exchange.json",
    "assets/redacted/hablaba-hero.png",
    "assets/redacted/hablaba-feature.png"
  ],
  "generation": {
    "model": "gpt-5.6-sol",
    "templateVersion": "1.0.0",
    "hyperframesVersion": "0.7.46"
  }
}
