{
  "$schema": "../../docs/project-videos/video-manifest.schema.json",
  "version": 1,
  "slug": "ba-eventos",
  "title": "BA Eventos",
  "family": "product-journey",
  "timing": "short",
  "viewer": "Nontechnical portfolio viewer",
  "takeaway": "This is an AI discovery product that turns scattered local event information into a useful plan.",
  "theme": {
    "canvas": "#0b0705",
    "surface": "#17100c",
    "ink": "#f7ead9",
    "muted": "#b9aa99",
    "border": "#3b2a1f",
    "accent": "#f3ab35",
    "accentSoft": "#3a2511",
    "accent2": "#69c9bf",
    "deep": "#211610",
    "fontDisplay": "EB Garamond, serif",
    "fontBody": "Inter, sans-serif",
    "fontMono": "JetBrains Mono, monospace",
    "motif": "path"
  },
  "scenes": [
    {
      "id": "scattered-plans",
      "kind": "problem",
      "eyebrow": "The problem",
      "headline": "Buenos Aires plans were scattered.",
      "body": "Posts and event sites lived apart.",
      "duration": 6,
      "layout": "copy-left",
      "asset": "assets/redacted/ba-eventos-hero.png",
      "assetAlt": "Redacted BA Eventos search page",
      "assetFit": "cover",
      "assetPosition": "center center",
      "labels": [
        {
          "title": "Social posts",
          "body": "One source"
        },
        {
          "title": "Event sites",
          "body": "Another source"
        },
        {
          "title": "Venue pages",
          "body": "More searching"
        }
      ],
      "transition": "push-left",
      "motion": "assemble"
    },
    {
      "id": "plain-question",
      "kind": "action",
      "eyebrow": "One question",
      "headline": "A visitor asks one plain question.",
      "body": "What is happening tonight?",
      "duration": 7,
      "layout": "copy-right",
      "asset": "assets/redacted/ba-eventos-hero.png",
      "assetAlt": "BA Eventos natural-language search prompt",
      "assetFit": "cover",
      "assetPosition": "center center",
      "transition": "push-up",
      "motion": "settle"
    },
    {
      "id": "grounded-search",
      "kind": "evidence",
      "eyebrow": "Grounded search",
      "headline": "BA Eventos searches real event records.",
      "body": "Events and venues stay attached to the answer.",
      "duration": 8,
      "layout": "report",
      "asset": "assets/redacted/ba-eventos-feature.png",
      "assetAlt": "Redacted BA Eventos answer with event results",
      "assetFit": "contain",
      "assetPosition": "center center",
      "labels": [
        {
          "title": "Events",
          "body": "Real catalog entries"
        },
        {
          "title": "Venues",
          "body": "Attached to each answer"
        }
      ],
      "transition": "dissolve",
      "motion": "assemble"
    },
    {
      "id": "usable-plan",
      "kind": "result",
      "eyebrow": "Useful result",
      "headline": "The answer becomes a usable plan.",
      "body": "Categories, times, venues, prices, and links stay visible.",
      "duration": 8,
      "layout": "copy-left",
      "asset": "assets/redacted/ba-eventos-feature.png",
      "assetAlt": "BA Eventos result cards with plan details",
      "assetFit": "contain",
      "assetPosition": "center center",
      "labels": [
        {
          "title": "Time",
          "body": "When it starts"
        },
        {
          "title": "Venue",
          "body": "Where it happens"
        },
        {
          "title": "Price",
          "body": "What it costs"
        },
        {
          "title": "Link",
          "body": "Where to continue"
        }
      ],
      "transition": "push-left",
      "motion": "settle"
    },
    {
      "id": "end",
      "kind": "end",
      "eyebrow": "BA Eventos",
      "headline": "BA Eventos",
      "body": "One grounded search.",
      "duration": 3,
      "layout": "full",
      "asset": "assets/redacted/ba-eventos-feature.png",
      "assetAlt": "Settled BA Eventos result screen",
      "assetFit": "contain",
      "assetPosition": "center center",
      "transition": "dissolve",
      "motion": "settle"
    }
  ],
  "posterAt": 24,
  "privacy": {
    "hide": [
      "Signed-in sidebar identity",
      "Account and session details",
      "Tokens, cookies, local paths, and environment details",
      "Private admin records"
    ],
    "safe": [
      "Redacted public BA Eventos screenshots",
      "Public project name",
      "Plain workflow labels",
      "Synthetic source cards and highlights"
    ]
  },
  "sources": [
    "brief.md",
    "project-video-source.md",
    "design.md",
    "sources.md",
    "../../src/content/case-studies/ba-eventos.mdx",
    "../../src/lib/projects/ba-eventos.json",
    "assets/redacted/ba-eventos-hero.png",
    "assets/redacted/ba-eventos-feature.png"
  ],
  "generation": {
    "model": "gpt-5.6-sol",
    "templateVersion": "1.0.0",
    "hyperframesVersion": "0.7.46"
  }
}
